{
  "schema": "uads.specialist-selection-plan",
  "schemaVersion": "0.9.0",
  "selectionPlanId": "sp_995d03589aea16e5",
  "projectId": "58233072c1c707ff",
  "workOrderId": "wo_191143702562d55e",
  "workOrderDigest": "b5831d364a42e8ac7a384b761b7ef71a0e341ad193edfe8d1fa9eca80c9716ac",
  "routingDigest": "9ceefeedecf69c7886ef3ffca60bf442281347a366badcdae540168732ab0b7a",
  "registryDigest": "e85c4d5081645bdcf5d5542505b1d43e37ea780be3374982c383db0e445cc9b7",
  "policyDigest": "44fee30855f39729a310fd1009069cf29beff8b094c0234f0c1160afb213d2cb",
  "changeDigest": null,
  "impactDigest": "72634fb077a6a3798883bad19077d58ce23583355db2a2409c44d1375bc2518e",
  "gateContractDigest": "e35730cf50fea66be80a0aa3a6172526b6a72106ea027d58d649064d641e5412",
  "selected": [
    {
      "specialistId": "repo-inspector",
      "kind": "core",
      "role": "Inspect repository metadata and project identity",
      "required": true,
      "reasonCodes": [
        "CORE_REQUIRED"
      ],
      "coversDomains": [
        "general"
      ],
      "coversGates": [],
      "independenceClass": "support"
    },
    {
      "specialistId": "requirements-engineer",
      "kind": "core",
      "role": "Normalize requirements and acceptance criteria",
      "required": true,
      "reasonCodes": [
        "CORE_REQUIRED"
      ],
      "coversDomains": [
        "requirements"
      ],
      "coversGates": [],
      "independenceClass": "support"
    },
    {
      "specialistId": "software-architect",
      "kind": "core",
      "role": "Bound cross-cutting architecture decisions",
      "required": true,
      "reasonCodes": [
        "ARCHITECTURE_SCOPE"
      ],
      "coversDomains": [
        "architecture"
      ],
      "coversGates": [],
      "independenceClass": "support"
    },
    {
      "specialistId": "implementation-planner",
      "kind": "core",
      "role": "Produce a bounded executable Work Order plan",
      "required": true,
      "reasonCodes": [
        "CORE_REQUIRED"
      ],
      "coversDomains": [
        "general"
      ],
      "coversGates": [],
      "independenceClass": "support"
    },
    {
      "specialistId": "implementation-agent",
      "kind": "core",
      "role": "Apply necessary in-scope product edits",
      "required": true,
      "reasonCodes": [
        "CORE_REQUIRED"
      ],
      "coversDomains": [
        "general"
      ],
      "coversGates": [],
      "independenceClass": "implementation"
    },
    {
      "specialistId": "test-engineer",
      "kind": "core",
      "role": "Design and run focused verification",
      "required": true,
      "reasonCodes": [
        "CORE_REQUIRED",
        "GATE_REQUIRES_SPECIALIST"
      ],
      "coversDomains": [
        "quality"
      ],
      "coversGates": [
        "build",
        "contract-test",
        "integration-test",
        "static",
        "unit-test"
      ],
      "independenceClass": "support"
    },
    {
      "specialistId": "checkpoint-manager",
      "kind": "core",
      "role": "Persist bounded resume and checkpoint state",
      "required": true,
      "reasonCodes": [
        "CORE_REQUIRED"
      ],
      "coversDomains": [
        "general"
      ],
      "coversGates": [],
      "independenceClass": "support"
    },
    {
      "specialistId": "backend-api-specialist",
      "kind": "domain",
      "role": "Handle backend, API, and SaaS boundaries",
      "required": true,
      "reasonCodes": [
        "DOMAIN_COVERAGE"
      ],
      "coversDomains": [
        "api",
        "backend",
        "saas"
      ],
      "coversGates": [],
      "independenceClass": "support"
    },
    {
      "specialistId": "finance-math-specialist",
      "kind": "domain",
      "role": "Handle finance, accounting, and numerical correctness",
      "required": true,
      "reasonCodes": [
        "DOMAIN_COVERAGE",
        "GATE_REQUIRES_SPECIALIST"
      ],
      "coversDomains": [
        "finance-economics",
        "mathematics-simulation",
        "tokenomics"
      ],
      "coversGates": [
        "financial-numerical-validation"
      ],
      "independenceClass": "support"
    }
  ],
  "assurance": [
    {
      "specialistId": "independent-reviewer",
      "kind": "core",
      "role": "Independently review the implementation",
      "required": true,
      "reasonCodes": [
        "INDEPENDENT_REVIEW_REQUIRED"
      ],
      "coversDomains": [
        "quality"
      ],
      "coversGates": [],
      "independenceClass": "independent-review"
    },
    {
      "specialistId": "security-reviewer",
      "kind": "assurance",
      "role": "Provide security assurance for sensitive changes",
      "required": true,
      "reasonCodes": [
        "GATE_REQUIRES_SPECIALIST",
        "SECURITY_ASSURANCE_REQUIRED"
      ],
      "coversDomains": [
        "security"
      ],
      "coversGates": [
        "security-review"
      ],
      "independenceClass": "assurance"
    }
  ],
  "assignments": [
    {
      "specialistId": "backend-api-specialist",
      "role": "Handle backend, API, and SaaS boundaries",
      "objective": "Add an authenticated API endpoint that exposes a user billing profile.",
      "coveredDomains": [
        "api",
        "backend",
        "saas"
      ],
      "relevantAffectedAreas": [
        "auth"
      ],
      "relevantFiles": [
        "auth"
      ],
      "relevantGates": [
        "build",
        "contract-test",
        "financial-numerical-validation",
        "integration-test",
        "security-review",
        "static",
        "unit-test"
      ],
      "evidenceObligations": [
        "backend/API verification"
      ],
      "riskLevel": "HIGH",
      "forbiddenScope": [
        "Must preserve authentication, contract, and data-boundary obligations.",
        "out-of-scope work",
        "unrelated architecture refactors",
        "unrelated marketplace or dashboard features",
        "unrelated Web3/tokenomics work"
      ],
      "dependencyGroup": 2,
      "parallelEligible": true
    },
    {
      "specialistId": "checkpoint-manager",
      "role": "Persist bounded resume and checkpoint state",
      "objective": "Add an authenticated API endpoint that exposes a user billing profile.",
      "coveredDomains": [
        "general"
      ],
      "relevantAffectedAreas": [
        "auth"
      ],
      "relevantFiles": [
        "auth"
      ],
      "relevantGates": [
        "build",
        "contract-test",
        "financial-numerical-validation",
        "integration-test",
        "security-review",
        "static",
        "unit-test"
      ],
      "evidenceObligations": [
        "atomic checkpoint"
      ],
      "riskLevel": "HIGH",
      "forbiddenScope": [
        "Must persist only sanitized sidecar state outside the managed project.",
        "out-of-scope work",
        "unrelated architecture refactors",
        "unrelated marketplace or dashboard features",
        "unrelated Web3/tokenomics work"
      ],
      "dependencyGroup": 1,
      "parallelEligible": false
    },
    {
      "specialistId": "finance-math-specialist",
      "role": "Handle finance, accounting, and numerical correctness",
      "objective": "Add an authenticated API endpoint that exposes a user billing profile.",
      "coveredDomains": [
        "finance-economics",
        "mathematics-simulation",
        "tokenomics"
      ],
      "relevantAffectedAreas": [
        "auth"
      ],
      "relevantFiles": [
        "auth"
      ],
      "relevantGates": [
        "build",
        "contract-test",
        "financial-numerical-validation",
        "integration-test",
        "security-review",
        "static",
        "unit-test"
      ],
      "evidenceObligations": [
        "gate:financial-numerical-validation",
        "numerical and edge-case validation"
      ],
      "riskLevel": "HIGH",
      "forbiddenScope": [
        "Must not hard-code vendor prices or authorize financial transfers.",
        "out-of-scope work",
        "unrelated architecture refactors",
        "unrelated marketplace or dashboard features",
        "unrelated Web3/tokenomics work"
      ],
      "dependencyGroup": 2,
      "parallelEligible": true
    },
    {
      "specialistId": "implementation-agent",
      "role": "Apply necessary in-scope product edits",
      "objective": "Add an authenticated API endpoint that exposes a user billing profile.",
      "coveredDomains": [
        "general"
      ],
      "relevantAffectedAreas": [
        "auth"
      ],
      "relevantFiles": [
        "auth"
      ],
      "relevantGates": [
        "build",
        "contract-test",
        "financial-numerical-validation",
        "integration-test",
        "security-review",
        "static",
        "unit-test"
      ],
      "evidenceObligations": [
        "in-scope change"
      ],
      "riskLevel": "HIGH",
      "forbiddenScope": [
        "Must not perform approval-gated actions or serve as the sole final reviewer.",
        "out-of-scope work",
        "unrelated architecture refactors",
        "unrelated marketplace or dashboard features",
        "unrelated Web3/tokenomics work"
      ],
      "dependencyGroup": 4,
      "parallelEligible": false
    },
    {
      "specialistId": "implementation-planner",
      "role": "Produce a bounded executable Work Order plan",
      "objective": "Add an authenticated API endpoint that exposes a user billing profile.",
      "coveredDomains": [
        "general"
      ],
      "relevantAffectedAreas": [
        "auth"
      ],
      "relevantFiles": [
        "auth"
      ],
      "relevantGates": [
        "build",
        "contract-test",
        "financial-numerical-validation",
        "integration-test",
        "security-review",
        "static",
        "unit-test"
      ],
      "evidenceObligations": [
        "Work Order plan"
      ],
      "riskLevel": "HIGH",
      "forbiddenScope": [
        "Must not dispatch work outside the selected scope.",